{
  "id": "technology.cooling.rear_door",
  "schemaVersion": 1,
  "name": "Rear-Door Heat Exchangers",
  "description": "Water-cooled heat exchangers mounted on the rack door.",
  "branch": "cooling",
  "tier": 3,
  "research": {
    "costRP": 5500,
    "durationDays": 300,
    "minimumCompanyLevel": 2,
    "requiredSpecialists": 6
  },
  "prerequisites": [
    "technology.cooling.chilled_water"
  ],
  "effects": [],
  "unlocks": {
    "cooling": [
      "cooling.rear_door"
    ]
  },
  "tradeOff": "Plumbing and maintenance complexity in every rack row."
}
