{
  "id": "technology.hardware.ai_accelerators_gen2",
  "schemaVersion": 1,
  "name": "Second-Generation Accelerators",
  "description": "The densest commercial accelerator available.",
  "branch": "hardware",
  "tier": 4,
  "research": {
    "costRP": 16000,
    "durationDays": 420,
    "minimumCompanyLevel": 3,
    "requiredSpecialists": 8
  },
  "prerequisites": [
    "technology.hardware.ai_accelerators",
    "technology.cooling.immersion_single"
  ],
  "effects": [],
  "unlocks": {
    "hardware": [
      "hardware.asic.gen2"
    ]
  },
  "tradeOff": "A deepening dependency on one vendor roadmap."
}
