{
  "id": "technology.network.n400g",
  "schemaVersion": 1,
  "name": "400G Networking",
  "description": "400 gigabit fabric for accelerator clusters.",
  "branch": "network",
  "tier": 2,
  "research": {
    "costRP": 4500,
    "durationDays": 210,
    "minimumCompanyLevel": 1,
    "requiredSpecialists": 4
  },
  "prerequisites": [
    "technology.network.n100g"
  ],
  "effects": [
    {
      "target": "network.transitCost",
      "operation": "multiply",
      "value": 0.92,
      "priority": 10
    }
  ],
  "unlocks": {
    "capabilities": [
      "net_400g"
    ]
  },
  "tradeOff": "Higher optics cost per port and a forklift upgrade of the spine."
}
