{
  "id": "technology.environment.advanced_carbon_accounting",
  "schemaVersion": 1,
  "name": "Advanced Carbon Accounting",
  "description": "Embodied, construction and supply-chain carbon accounting.",
  "branch": "environment",
  "tier": 3,
  "research": {
    "costRP": 8000,
    "durationDays": 300,
    "minimumCompanyLevel": 2,
    "requiredSpecialists": 6
  },
  "prerequisites": [
    "technology.environment.carbon_reporting"
  ],
  "effects": [
    {
      "target": "company.reputationGain",
      "operation": "add",
      "value": 0.3,
      "priority": 10
    }
  ],
  "unlocks": {
    "capabilities": [
      "scope3_ledger"
    ]
  },
  "tradeOff": "Scope 3 makes the embodied carbon of every purchase visible."
}
