{
  "id": "technology.hardware.high_density_computing",
  "schemaVersion": 1,
  "name": "High-Density Computing",
  "description": "Rack, busbar and airflow engineering for high-power rows.",
  "branch": "hardware",
  "tier": 2,
  "research": {
    "costRP": 3000,
    "durationDays": 210,
    "minimumCompanyLevel": 1,
    "requiredSpecialists": 4
  },
  "prerequisites": [
    "technology.cooling.containment",
    "technology.hardware.cpu_gen2"
  ],
  "effects": [
    {
      "target": "cooling.densityKwPerRack",
      "operation": "multiply",
      "value": 1.1,
      "priority": 10
    }
  ],
  "unlocks": {
    "capabilities": [
      "high_density_layout"
    ]
  },
  "tradeOff": "Every kilowatt of density added is a kilowatt cooling has to answer for."
}
